Product URL,Product Name,Product Price,Rating,Number of ratings,Number of reviews,Description,ASIN,Product Description,Manufacturer
https://www.amazon.in/BennettTM-Shoulder-Messenger-Repellent-Charcoal/dp/B09CV24TMK/ref=sr_1_79?crid=2M096C61O4MLT&keywords=bags&qid=1679388149&sprefix=ba%2Caps%2C283&sr=8-79,Bennett™ Mystic Unisex Adult Men's Laptop Bag 15.6 inch Side Shoulder Briefcase Satchel Messenger Business Bags for Men & Women Front Pocket for Laptop Accessories - Black (6 Month Warranty),₹512,4.1 out of 5 stars,"5,212","1,015"," PREMIUM QUALITY MATERIAL: This laptop computer briefcase is made of high-quality water repellent fabric, and well-made of foam pad inside. The laptop briefcase equipped with a removable shoulder strap and a soft carry handle, you can easily switch the carry way you want.   LIGHTWEIGHT AND MULTIFUNCTIONAL: It provide a removable shoulder strap, can be use as shoulder bag or handbag base on your need; top handle strap, and comes with adjustable strap with. It will be a good partner for your daily use or business trip.   EXCELLENT DETAILS: The laptop bag with exquisite zippers, durable hook of strap and soft handle, which make it more comfortable to carry and use. Ensure a secure and long-lasting usage everyday as office work bag, travel laptop briefcase, business laptop case, college laptop bag.   DIMENSION: External: 16 x 12 x 3 inch; Dimension: 16.5 x 11.5 x 2.5 inch. Suitable for 14-15.6 inch: Dell, Acer, ASUS, Samsung, HP and other brand laptops.(Please allow a little size different because of manual measurement). Great gifts choice for birthday, work anniversary.   BENNETT Warranty: Exchange within (6 months) if you don't like. If any problems, please do not hesitate to contact us. We will provide the best solution for you.  ",,,
https://www.amazon.in/YuvKuz-TM-Infocus-Digitizer-Assembly/dp/B07MXNWTB2/ref=sr_1_80?crid=2M096C61O4MLT&keywords=bags&qid=1679388149&sprefix=ba%2Caps%2C283&sr=8-80,Lavie Women's Nova Tote Bag | Ladies Purse Handbag,₹989,4.2 out of 5 stars,"7,453",638," Lavie Malnov tote is a stylish offering for ladies. It is durable, light weight and super spacious. Made from vegan leather, this large hand bag comes in Herringbone, Woven and Croco texture pattern at the front.   Woven Texture- 45 cm in length x 12 cm in width x 35 cm in height   Malnov hand bag has a top zip closure for safety and comfort. The interior has 2 slip pockets along with 1 zip pocket providing plenty of storage space for keeping phone, portable charger, keys, hairbrush, wallet, sunglasses, sanitizer and a pair of clothes.   This latest tote is perfect for women to carry for a weekend getaway or even a day at the mall for shopping. It can be paired with formal pants & blazer as well as with a basic crop top and jeans. This spacious and sturdy bag makes for a perfect gift for all your occasions.   The bag has a well stitched inner lining and high quality zippers for easy accessibility and storage.  ",B07MXNWTB2,This trendy Red tote from Lavie is an absolute necessity. It has a woven pattern for a twigged Indian appeal. Fuse it with your favourite denims and heels.,Bagzone Lifestyle Pvt Ltd
https://www.amazon.in/HEROZ-Backpack-Resistant-Computer-17-3-inch/dp/B083N3DCTM/ref=sr_1_81?crid=2M096C61O4MLT&keywords=bags&qid=1679388242&sprefix=ba%2Caps%2C283&sr=8-81,HEROZ Hacker 50 litres Nylon Travel Laptop Backpack Water Resistant Slim Durable Computer Book Bag Tracking Fits Up to 17.3-inch Laptop (058- ALL) (Navy Blue),"₹1,439",4.1 out of 5 stars,"3,717",455," Material: Nylon, Inner Material: Polyester, Capacity: 50 Liters, Color: Grey & Navy Blue, Special Features: Back Padding, Chest Strap, Earphone Cord Support, Hip Belt, Integrated Rain Cover, Laptop Compartment, Telescope Handle, Water Bottle / Umbrella Pouch, Zip Closure, Padded Handles, Shoulder Strap<br> <br>   Age Range Description: Adult; Style Name: Country; Pattern Name: Solid; Strap Type: Cross-Body; Closure Type: Zipper; Pocket Description: Utility Pocket <br>  ",,,
https://www.amazon.in/Half-Moon-Trekking-Bags-Compartment/dp/B08PSX1LN9/ref=sr_1_82?crid=2M096C61O4MLT&keywords=bags&qid=1679388242&sprefix=ba%2Caps%2C283&sr=8-82,Half Moon 45L Hammer Waterproof Laptop Travelling Rucksack Trekking Backpack for Travel Journey bags for Men Women Boys & Girls with 17.3inch Laptop Compartment & Rain cover,"₹1,299",4.1 out of 5 stars,"1,013",103," SPECIAL FEATURES : Back Padding, Chest Strap, Earphone Cord Support, Unique Design, Hip Belt, Integrated Rain Cover, Laptop Compartment, Telescope Handle, Water Bottle / Umbrella Pouch, Zip Closure, Padded Handles, Padded Shoulder Strap , Breathable Mesh etc.<br>; Closure Type: Zipper; Age Range Description: Adult; Color Name: Navy Blue<br>; Closure Type: Zipper; Age Range Description: Adult<br><br> <br>   Compartment Description: Up To 17 Inches<br><br> <br>   Pattern Name: Solid <br>  ",B08PSX1LN9,"This Rucksack backpack ensures complete safety to your 17.3 inch laptop with high quality build and a wide range of built-in features, With a Dual Side Pocket In the inside of the bag, featuring protective padding, you can rest assured that the laptop inside it will be well cushioned from any accidents caused when you bump into any surface. As it is made of nylon, can withstand abrasions and is long lasting. Chest Strap, Hip Belt, Straight Shaped Straps structure which fits on your shoulders very comfortably makes you lift heavy objects easily. A Front Pocket with an Organizer helps you store your small essentials. It also features Reflector Logo, Rain cover and Reflector patch which is highly useful for motorists, cyclists, walking at night. It also features an Earphone Cord Support which very useful for long travelers. The inner material is made of polyester. This backpack is also water-resistant.",AB Amazing Bags
https://www.amazon.in/Safari-Casual-Backpack-Charging-Resistant/dp/B09B2581S9/ref=sr_1_83?crid=2M096C61O4MLT&keywords=bags&qid=1679388242&sprefix=ba%2Caps%2C283&sr=8-83,"Safari Sneak Casual Backpack with USB Charging Port 26 Ltrs Water Resistant Fabric - Grey, L (SNEAK19CBGRE)",₹949,3.7 out of 5 stars,822,70," 100% Polyester, High Quality, Durable and Water Resistant Fabric   Front storage pocket keeps smaller items neatly organized and easy to access   Mesh pockets on both sides to accommodate your water bottle and umbrella   USB Charging Point to Charge On the Go - With our attached charging dock, now charing on the go is easier than before. Important Note: We do not provide Free Portable Charger with the Bag; 1-year International Warranty against manufacturing defects   Special Features: Lightweight; Closure Type: Zipper; Age Range Description: Adult  ",B09B2581S9,"Safari Sneak is a 26 Litres, 2 compartment USB backpack perfect for daily usage. Built in USB charging port outside and built in charging cable inside, perfect for working professionals and college goers. This backpack is especially designed for todays fast paced world, where everything should be compact and lightweight. This backpack is perfect for everyday usage such as office, college, school, tuitions, or short holiday trips. The front pocket is designed to keep your essentials organized and side mesh pockets are perfect for storing your water bottle and umberella. Made of high grade water resistant polyester fabric, this backpack will last you several trips.",Safari Industries
https://www.amazon.in/Li-Ning-Panther-Double-Polyester-Badminton/dp/B09VDQDXWN/ref=sr_1_84?crid=2M096C61O4MLT&keywords=bags&qid=1679388242&sprefix=ba%2Caps%2C283&sr=8-84,Li-Ning Panther Double Zipper Polyester Badminton Kit Bag,₹999,4.3 out of 5 stars,314,35, Comfy & Sturdy - Li-Ning Panther Kit Bag is not only stylish in looks but also features comfortable straps and sturdy buckles.   Finesse - This bag is crafted with premium lightweight tear-resistant fabric and high-grade polyester for a superior finish.   Soft and Comfortable Padding - Comfortable soft padded design with thick but soft multi-panel ventilated padding gives you maximum support.   Dynamic Zippers - The Li-Ning Panther KitBag is equipped with dynamic zippers that have easy open and close functionality and are sturdily built.   Easy to carry - The Li-Ning Panther Kitbag comes with rounded stitched grip handles that give you the option of easy mobility.  ,,"The Li-Ning Panther Badminton Kit Bag comes with 2 spacious compartments for all the gear you need to be on your path to glory! It is made with premium quality polyester material. It features cushioned & insulated compartments, a dedicated shoe compartment, and an adjustable shoulder strap making it an all-rounded dynamic bag.",
https://www.amazon.in/Motherly-Stylish-Babies-Diaper-Mothers/dp/B07DMKJJB4/ref=sr_1_85?crid=2M096C61O4MLT&keywords=bags&qid=1679388242&sprefix=ba%2Caps%2C283&sr=8-85,motherly 25 ltrs (25 Cms) backpack(5860_grey),"₹1,736",4.5 out of 5 stars,"5,477",904," The bag measures: 39.5 cm x 26 cm x 20 cm, Weighs: 700 gm  ",,,
https://www.amazon.in/Resistant-Duffle-Shoulder-Separate-Compartment/dp/B09KVBSG61/ref=sr_1_86?crid=2M096C61O4MLT&keywords=bags&qid=1679388242&sprefix=ba%2Caps%2C283&sr=8-86,"Wooum Gym Bag Sport Outdoor Bag, Shoulder Bag Side Bag with Separate Shoes Compartment Water Resistance - Dark Grey",₹397.10,4.2 out of 5 stars,466,55, Product Size - 16.5 x 9 x 9 Inches or 42x23x23 cm  ,B09KVBSG61,,Wooum
https://www.amazon.in/Half-Moon-Waterproof-Laptop-Backpack/dp/B09QM9N1B3/ref=sr_1_87?crid=2M096C61O4MLT&keywords=bags&qid=1679388242&sprefix=ba%2Caps%2C283&sr=8-87,Half Moon 30L Waterproof 15.6 inch Laptop Office School College Bag Backpack for Men Women Boys & Girls,₹589,3.6 out of 5 stars,361,44," SPACIOUS AND LIGHTWEIGHT: Light weight and spacious laptop backpack with 3 compartments. One compartment is for carrying laptop inside (Upto 17 inches), with padding for safety, and space for laptop accessories like charger, etc. Second large compartment for books, files and all your day to day essentials. And third compartment is for your extra stuff. It has provision for holding bottles on both sides and has padded shoulder straps for your comfort<br>   COMFORT WITH QUALITY: This casual bag has Wide, Padded and Adjustable shoulder straps and Padded Back for comfort in carrying heavy items. Stitched properly and Bartacks on every pressure point for extra durability. Made with strong yet light weight polyester fabric with heavy zippers. Serves the need of a professional office laptop bag, college bag, student backpack, school bag and is suitable for all, i.e. boys, girls, men? and women?<br>   PREMIUM FABRIC : Premium Polyester, Stylish and durable backpack for school /college and travel. Easily accommodate a laptop. Size: 45 cm X 31 cm X 22 cm; INTERNAL ORGANISER: This backpack features an Internal Organiser that is small pockets inside the front compartment for holding pens, ID cards, etc. These pockets are very useful in organizing your small day-to-day items.<br>   OTHER FEATURES: Strong and durable zippers, Adjustable Shoulder Handles (Straps) , 2 Bottle/Umbrella holders , Padded Handle , Padded Laptop Compartment , Ergonomic Design, Reflector Logo, etc<br>   Water Resistance Level: Water Resistant; Pocket Description: Utility Pocket; Pattern Name: Solid; Age Range Description: Adult; Compartment Description: Up To 17 Inches<br>  ",B09QM9N1B3,"FEATURES: DURABLE MATERIAL: Made with strong polyester fabric with heavy zippers. Serves the need of a professional office laptop bag, college bag, student backpack, school bag and is suitable for all, i.e. boys, girls, men and women; COMFY & STURDY: Its padded, adjustable shoulder straps do not put pressure on the shoulders. Foamed padded top handle is easy on your palm and fingers; DURABLE AND LIGHT WEIGHT MATERIAL: Made with strong yet light weight polyester fabric with heavy zippers; INTERNAL ORGANISER: This backpack features an Internal Organiser that is small pockets inside the front compartment for holding pens, ID cards, etc. These pockets are very useful in organizing your small day-to-day items; LOTS OF STORAGE SPACE & POCKETS: One separate Padded laptop compartment. Multiple compartments can store lots of stuff, that too organised.",Half_Moon
https://www.amazon.in/Nivia-Deflate-5180BK-Polyester-Round/dp/B07222KX3S/ref=sr_1_88?crid=2M096C61O4MLT&keywords=bags&qid=1679388242&sprefix=ba%2Caps%2C283&sr=8-88,NIVIA Deflate Round 01 Polyester Gym Bag/Unisex Gym Bags/Adjustable Shoulder Bag for Men/Duffle Gym Bags for Men/Carry Gym Accessories/Fitness Bag/Sports &Travel Bag/Gym kit Bag,₹449,4.2 out of 5 stars,"7,268",744," Strong stitching at major stress points provide long-lasting durability against daily activities. Main compartment with zip closure   Durable zippers and enhanced by strong stitching at major stress points   Lightweight and fold-able, It's easy to fold up into small compact space.   Water-resistant finish to save inner items from water splashes .   Optimum quality of accessories and zipper for smoother functioning and high durability  ",,,
https://www.amazon.in/Lunars-Travel-Laptop-Bag-compartments/dp/B08NHL52MK/ref=sr_1_89?crid=2M096C61O4MLT&keywords=bags&qid=1679388242&sprefix=ba%2Caps%2C283&sr=8-89,"Lunar's Unisex 50L Water Resistant Office/Travel/Business Laptop Backpack, Bag for up to 17.3 inch Laptop/MacBook with rain Cover and 2 Large compartments","₹1,199",4.0 out of 5 stars,"2,482",289," MADE IN INDIA - This “MAKE IN INDIA” Laptop bag for men features 2 large zippered compartments, 1 zip pocket at front, 2 side bottle pockets, 4 lash points for yoga mat/help and 1 chest belt pocket to keep valuables; Age Range Description: Adult; Color Name: Mblue; Compartment Description: Greater Than 17 Inches; Pattern Name: Solid; Style Name: Casual Backpack; Pocket Description: Zipper Pocket.   PADDED LAPTOP SLEEVE AND INTERNAL ORGANISER : Padded Laptop sleeve with holder to secure upto 17.3"" Laptops. Compatible with laptops like HP / Lenovo / Acer / ASUS / Dell. Internal organiser of this backpack for men is neatly organise and store your keys, cables, stationary and other valuables from theft. This laptop bag cum backpack can be used for office, college, school or even for hiking or trekking.   INBUILT RAIN COVER – The Laptop bag for men has inbuilt raincover pocket at the bottom with Rain cover provided to help you protect your stuff from rain and dust. The Raincover is made of premium imported polyester fabric that can withstand heavy rains.   BEST BACK SUPPORT - We have designed the laptop bag keeping your comfort in mind. In this backpack for men there are 2 load lifters on the backside to adjust your shoulder position based on weight. 2 Side load compression straps help to adjust the size of bag. Shoulder has 12MM high density padding, with adjustable sternum straps for chest support and adjustable padded hip belt for weight balancing on chest and hips.   WATER RESISTANT WITH 1 YEAR WARRANTY – This Laptop bag for men is stylish and durable unisex travel laptop backpack that is your perfect travel partner also suitable for Hiking or trekking. Size: 21 inch X 14 inch X 10.5 inch. Capacity : 50 litres. This Bag/Backpack is made of high-grade water-resistant polyester material that gives it strength and durable for long-term use. 12 months warranty for any manufacturing defects.  ",B08NHL52MK,,"Akshaya Rubbers, Hebbal Industrial Area, Mysore"
https://www.amazon.in/Puma-76855-teamGOAL-Backpack-Core/dp/B07XJPLL27/ref=sr_1_90?crid=2M096C61O4MLT&keywords=bags&qid=1679388242&sprefix=ba%2Caps%2C283&sr=8-90,Puma Unisex teamGOAL 23 Backpack Core Black X,₹939,4.3 out of 5 stars,"2,620",255, Superior Quality   PUMA Branded  ,B07XJPLL27,Flaunt the latest & coolest styles from PUMA,Puma
https://www.amazon.in/Wildcraft-Turnaround-Polyester-Laptop-8903340000000/dp/B012D4QWES/ref=sr_1_91?crid=2M096C61O4MLT&keywords=bags&qid=1679388242&sprefix=ba%2Caps%2C283&sr=8-91,Wildcraft Turnaround Polyester 14 inch 27 Ltrs Blue Laptop Bag (8903340000000),"₹1,895",4.3 out of 5 stars,"3,229",687," Outer Material: Polyester, Color: Blue   Water Resistance: Water resistant; Dimensions: 36 cms x 13 cms x 50 cms (LxWxH)   Number of compartments: 3   Laptop Compatible: Fits up to 15.4 laptop   Light Weight   Note : Laptop compartment has no strap  ",B012D4QWES,The durable Peza workpack is designed for travel enthusiasts. It perfectly organizes your belongings and comes with a specially designed padded back system for enhanced carrying comfort. Laptop Compatible: Fits up to 15.4 laptop ; Quick-access side mesh pocket ; Ventex back system allows ventilation and better airflow.,Wildcraft
https://www.amazon.in/Nivia-String-5177NB-Polyester-Navy/dp/B071H3HLVV/ref=sr_1_92?crid=2M096C61O4MLT&keywords=bags&qid=1679388242&sprefix=ba%2Caps%2C283&sr=8-92,Nivia Polyester String Bag,₹193,4.1 out of 5 stars,992,186, Made in India - with pride   This Nivia backpacks have one main compartment is secured with drawstring rope closure   This backpack is perfect for athletes and students on the go   Material: Polyester   In-Box Contents: 1 String Bag   Country of Origin: India  ,,,
https://www.amazon.in/Chic-Buddy-Waterproof-Swimsuits-Toiletries/dp/B09KSBHC18/ref=sr_1_93?crid=2M096C61O4MLT&keywords=bags&qid=1679388242&sprefix=ba%2Caps%2C283&sr=8-93,"Chic Buddy Waterproof Wet Bag, Washable, Reusable for Travel, Beach, Pool, Stroller, Diapers, Dirty Gym Clothes, Wet Swimsuits, Toiletries",₹299,4.4 out of 5 stars,281,39," Convenient – Our wet bags are great for carrying diapers, dirty gym clothes and wet swimsuits; not just for wet stuff - these bags make excellent organizers for toys, accessories, toiletries, electronics, travel and more   Reuse And Reduce Waste – The better alternative to single-use plastic bags, our bags are made of Chic Buddys' original waterproof fabric that’s both soft and strong (although fabric is waterproof, bags are not completely leakproof due to zippered closure)   Waterproof – Chic Buddys’ original fabric is 100% polyester with embedded TPU for waterproofing and our heat-sealed seams keep the mess where it belongs - inside the bag   Lots Of Uses – Not just for wet stuff - these bags make excellent organizers for toys, accessories, toiletries, electronics, travel and more! With a snap handle, snap your bag wherever you need it - stroller, changing table or suitcase   Easy-To-Clean – Wipe small messes; hand-wash or machine wash; to extend the life of fabric, we do recommend hang drying our quick-dry fabric; always ensure fabric is completely dry before storing  ",B09KSBHC18,,
https://www.amazon.in/Bennett-15-6-inch-College-Repellent-Backpack/dp/B09WZHX3B1/ref=sr_1_94?crid=2M096C61O4MLT&keywords=bags&qid=1679388242&sprefix=ba%2Caps%2C283&sr=8-94,"Bennett Casual Laptop Bag school bags for boys girls 15.6-inch, 25 LTR Office & College bags for mens Water Repellent Backpack for Men & Women (Black)",₹512,4.0 out of 5 stars,435,186," PERFECT SIZE & STORAGE SPACE: Laptop backpack with perfect size to hold things and your 15.6 inch laptop or 15 inch, 14 inch Laptop. Convenient main pockets for iPad, charger, binders, books, clothes, ect. Inside pockets keep your wallet, phone. school bag for girls / bags for women / kids school bag / college bags for boys / laptop backpack .   Front two slanted pocket perfect for quick finds such as your ID for work, f gear laptop bags . keys for open door, two side pockets for water bottle and compact umbrella make your items organized. it can be use as school college bags for girls / backpack for men /backpacks for women . you can use it as a gift for men . bags for travelling   COMFY & STURDY: Made from WATER RESISTANT and DURABLE ECO-FRIENDLY nylon fabric with Two PADDED shoulder straps, relieve the stress of shoulder, simple but comfortable back design offer your great back support, making your working, journey and travelling more convenient wherever you go. you can use it such as office bag for men . office bag for women .   Light-weight Carrying and perfect for business traveling or trip, weekend getaways, back to school, outdoor activities and college bag for men etc;   MULTIPURPOSE & SIZE: 20 x 12.2 x 5.7 Inch, perfect to throw under your seat on an airplane when you are traveling or on business trip. Suitable for back to school college, can be easily stored. Good choose for a business laptop backpack, work backpack, laptop bag for men and women, also will be a good gifts for women, gifts for men, gifts for boyfriend or girlfriend and gift bag for travelers.   strap_type: Shoulder Strap  ",,,
https://www.amazon.in/Safari-Spartan-Water-Resistant-Backpack/dp/B09B277CR5/ref=sr_1_95?crid=2M096C61O4MLT&keywords=bags&qid=1679388242&sprefix=ba%2Caps%2C283&sr=8-95,"Safari Spartan 21 Ltrs Water Resistant Backpack - Teal, S (SPARTAN19CBTEA)",₹599,3.8 out of 5 stars,645,48, Lightweight yet durable backpack/daypack for school use or everyday outings   Front storage pocket keeps smaller items neatly organized and easy to access   Mesh pockets on both sides to accommodate your water bottle and umbrella   Mesh Padding on back & shoulder strap to provide comfort & better back support; 1-year International Warranty against manufacturing defects   Age Range Description: Adult; Closure Type: Zipper; Lining Description: Polyester  ,B09B277CR5,"Safari Spartan is a 21 litres lightweight backpack that would be your perfect daily companion. It is perfect for carrying all your essentials when you are ready to go! Made of high grade water resistant polyester fabric, makes this backpack durable and a long lasting accessory. Safari Spartan also comes with a quick access front pocket and side mesh pockets to keep your essentials organized.",Safari Industries
https://www.amazon.in/BESTAQUA-Capacity-Cosmetic-Cosmetics-Organizer/dp/B0BW62ZR8N/ref=sr_1_96?crid=2M096C61O4MLT&keywords=bags&qid=1679388242&sprefix=ba%2Caps%2C283&sr=8-96,"BESTAQUA Large Capacity Cosmetic Travel Bag, Women's Makeup Travel Bag Portable Leather Cosmetics Bag, Makeup Storage Bags with Handle and Divider,Makeup Organizer Bags(Multi)",₹799,1.0 out of 5 stars,1,1," ☑️【2023 New Upgraded Design】The compact cosmetic bag for women has a classic Square stripe design, very elegant and stylish, perfect for personal use or as a gift! All these handing makeup bags for purse with a handle, it is easy to carry when you are on the go.   ☑️【Premium Materials】This makeup travel bag is made of waterproof PU leather with a high-quality metal zipper for easy closure. The cosmetic bags is easy to clean and performed well in prevents things inside from getting wet or slipping off. Even when it is full, it can maintain a good shape and is not easily deformed.   ☑️【Large capacity Cosmetic Bag】The size of cosmetic travel bag is 25x12x13 cm/9.8x4.7x5.1in. Ideal for holding all your beauty products. The 2 large main compartment can be used to store large skin-care product, while 3 side pockets for small items like eyeshadow, concealer or lipstick.   ☑️【Multifunctional Storage】practical cosmetic bags can be uesd as toiletry bag, makeup pouch, travel storage bag, jewelry case, medicine bag, digital accessories bag, wash bag. It is ideal for travel, vacation, business trip, gym, camping, bathroom organization and outdoor activities.   ☑️【Perfect Gift】The organizer travel bag for girl looks simple and elegant, suitable for both home and travel to organize your personal and travel items.It's a good ideal gift for women, friends,wife and those who always in travel. Also a great holiday or birthday gift for women and girls.  ",B0BW62ZR8N,"Portable travel cosmetic storage bag Are you still worried about not finding a makeup bag that suits you? The large capacity cosmetic bags meet your needs! This is a cosmetic bag with a three-dimensional design that is not easily deformed, where the padded semi-flexible shell protects your belongings from external pressure. This Make up Bags not only can storage your cosmetics, but also Jewelry, Electronic Accessories, Camera, Essential oil, Toiletries, Shaving Kit, glasses,Valuable objects and so on. DURABLE ZIPPER High quality zipper, durable and not easy to damage. High-grade zipper closure for easy opening and closing. The widened zipper makes the bag more three-dimensional. BIG CAPACITY This bag has a large capacity and can hold many essentials for going out. Multiple sections are neatly arranged to keep your essentials organized.C SMOOTH HANDLES Portable handle design makes it easy to carry, so it won't be a burden for travel, but a good helper. Multifunction Storage Bag The makeup storage bag is not only for travel cosmetics, but also can be used to store other items, such as electronic accessories, cameras, sunglasses, jewelry, valuables and so forth. It can be seen as a must-have item for your daily life or on a journey.",
