Product URL,Product Name,Product Price,Rating,Number of ratings,Number of reviews,Description,ASIN,Product Description,Manufacturer
https://www.amazon.in/Baggit-Womens-Laptop-Bag-Large/dp/B0BNTPMT2G/ref=sr_1_151?crid=2M096C61O4MLT&keywords=bags&qid=1679388614&sprefix=ba%2Caps%2C283&sr=8-151,Baggit Women's Laptop Bag - Large (Blue),"₹1,259",Previous page,0,0," A bag that carries your world! A tote bag is a shoulder bag with parallel handles and comes either with or without side panels.   Blue exterior with 1 main compartment I 3 total number of pocket I Zipper closure I Cruelty-free premium material   Dimension :- Length : 40.64 cm x Width : 12.7 cm x Height : 30.48 cm   Made in India | 6 Months warranty | Leading fashion laptop bag brand since 30 years.   The elegant women's laptop bag is a perfect match for different occasions, such as travel, shopping, and other daily use, which could be a great ideal gift for your family and friends on their birthdays, anniversaries, weddings, and other special events.  ",B0BNTPMT2G,"A bag that carries your world! A tote bag is a shoulder bag with parallel handles and comes either with or without side panels. It can also be loose or structured depending on the functionality. It has one big spacious compartment or can be organized into 2-3 main compartments. It's perfect for long hour outings, shopping or as work wear bags.",Baggit India Pvt Ltd
https://www.amazon.in/uppercase-Backpack-2300EBP1-resistant-sustainable/dp/B0BWNCV31F/ref=sr_1_152?crid=2M096C61O4MLT&keywords=bags&qid=1679388614&sprefix=ba%2Caps%2C283&sr=8-152,"uppercase Medium 17 Ltrs Vegan Leather (upto 14 inch) Laptop Backpack 2300EBP1 3x more water resistant sustainable bags with rain proof zippers for Men, Women, Boys and Girls, 750 Days warranty","₹1,600",4.0 out of 5 stars,373,72," Care Instructions: Wipe with Damp Cloth   Handcrafted with care and made up of premium quality robust material   Wrinkle free bag and 3x more water resistant with Rainproof zippers; Trolley sleeve to securely place the bags on the luggage   Right sized with sturdy stitching; Dimension: (28.2 cm x 14.1 cm x 42.2 cm); Warranty: 750 days international warranty   GRS certified for sustainability; The GRS (Global Recycled Standard) is intended for use with any product that contains at least 50% Recycled Material (License No. CMPY-158596)   Padded laptop compartment fits up to 14”, Back padding with Air mesh; Front access pocket for you to easily carry important small items with two bottle holders on the sides  ",B0BWNCV31F,,Acefour Accessories Pvt. Ltd.
https://www.amazon.in/Skybags-New-Neon-Backpack-Purple/dp/B07SRHCF9R/ref=sr_1_153?crid=2M096C61O4MLT&keywords=bags&qid=1679388614&sprefix=ba%2Caps%2C283&sr=8-153,Skybags New Neon 30 L Backpack (Purple),₹999,4.3 out of 5 stars,100,14, Colour: Purple<br><br><br>   Capacity: 30 L<br><br><br>   Compact backpack<br><br><br>   Special Features: Back Padding; Closure Type: Zipper<br><br>   Water Resistance Level: Water Resistant; Material Type: Polyester; Age Range Description: Adult<br>  ,B07SRHCF9R,"Our collection is a range of modern and functional products crafted to suit the varying needs of the aspirational youth of the country. Leading the pack with more space and durability, Skybags has a bag for every need and occasion. We offer hard/soft luggage uprights, duffel trolleys, office bags, suitcases and briefcases.",Future Retail
https://www.amazon.in/Genie-Clara-Backpack-Women-compartments/dp/B097JJGR1N/ref=sr_1_154?crid=2M096C61O4MLT&keywords=bags&qid=1679388614&sprefix=ba%2Caps%2C283&sr=8-154,"Genie Clara Backpack for Women - 3 compartments, Laptop Bags for Girls, Stylish and Trendy College Backpacks for Girls, Water Resistant and Lightweight Bags for Office and Travelling Purpose.","₹1,025",4.2 out of 5 stars,56,6," Made with High Quality fabric. Outer material: Nylon Twill - Soft, Durable and Water Resistant. Capacity: 36 liters, Dimensions: 48 x 33 x 23 cm Warranty: 12 months   3 Spacious compartment: Store your Books, Stationary, Accessories, Lunch boxes, etc. It will store plenty of items. Laptop Sleeve: Ensure that your laptop is stored separately and Securely! Organizer: Keep every single item separately in an arranged manner, with the help of our organizer. 2 side pocket: For holding water bottle, clipping pens or pencil or storing other items. 1 Front Pocket: Easily accessible. To keep all your essentials such as wallet, ticket, cosmetics.   Easy grab padded handle: For added comfort and convinience to hold the bag. Padded and Ergonomic Shoulder Straps: There is padded back mesh and ergonomic straps that gives extra spine and shoulder support and helps in minimizing the load after carrying the bag through a busy day at campus.This women's backpack can be carried to work, college, school, for a day out or even while you are travelling!   Light Weight yet Durable to resist the weight of textbooks, stationary, lunch boxes. Can store all your college or office stationary, without any hassle.   Stylish & Cute: This bag is designed for those Millennials and GenZ, who aren't afraid to compromise on Utility or Fashion! It is a perfect, small bag to carry all the daily essentials while using it as a trendy accessory, or a travel bag or as a college backpack.  ",B097JJGR1N,"How do you describe a Perfect School Backpack? Spacious enough to carry all the books, yet Light Weight! Padded Laptop Sleeve to keep it secure and sound. Multiple Pockets to segregate all the items and keep it easily accessible. An Organizer to keep your each and every school supplies in an arranged manner. Side Pocket to keep the Water Bottle. Water Resistant exteriors to keep all your worries at bay and lastly, latest and trendy design to keep those ""Cute Bagpack"" compliment coming in! Yes. We have that Perfect Bag for you, in our Genie store. Bringing you a cute, stylish and trendy design, Genie Clara School Bag.",Safari
https://www.amazon.in/POLESTAR-backpack-Backpack-College-Students/dp/B08X2JSJ6N/ref=sr_1_155?crid=2M096C61O4MLT&keywords=bags&qid=1679388614&sprefix=ba%2Caps%2C283&sr=8-155,"POLESTAR Leader 34 L Bag for College, School, Office, Casual Multipurpose Backpack with 15.6"" Laptop Compartment, Water Resistant, Unisex Design, Stylish & Durable, 1 Year Warranty",₹599,4.1 out of 5 stars,"3,429",374," Care Instructions: Wipe with Damp Cloth   PADDED LAPTOP COMPARTMENT WITH MAXED OUT STORAGE : Generous 34 Ltrs backpack with Dimension of 35 Cm x 24 Cm x 45 Cm, 3 full size compartments & 2 side pockets, Fits upto 15.6 inches Laptop with elasticated strap lock at just 560 grams.   CRAFTED WITH PRECISION : Made with strong, water resistant Polyester fabric for a lightweight and durable finish. Our polestar Leader backpack is a blend of style and utility. A classic design with opulent detailing and aesthetic silhouette adds to your style and keeps your belongings safe.   COMFORTABLE CARRY : This strong and impervious backpack is a fabulous choice for daily use. Guaranteed for strength and durability, it has padded breathable mesh back and adjustable straps. The interiors have added foam padding to protected electronics. Ergo-Grip Backstraps that distribute weight evenly over your shoulders and back, while the integrated top grab handle lets you move effortlessly.   BENEFITS: 3 main compartments provide optimal organisation, with premium zippers keeping your valuables protected, 2 side water bottle pockets help keep your goods dry and body hydrated.   VERSATILITY : This made in india versatile backpack comes with 12 months warranty, and is perfect for everyone, men, women, students, boys & girls, can be used as school, college, office or day travelling backpacks. All in one LEADER BACKPACK by Polestar.  ",B08X2JSJ6N,,POLESTAR
https://www.amazon.in/Police-Polyester-Laptop-Spec-Backpack/dp/B07ZB8NWTZ/ref=sr_1_156?crid=2M096C61O4MLT&keywords=bags&qid=1679388614&sprefix=ba%2Caps%2C283&sr=8-156,POLICE Polyester 35 Ltr Laptop Big Low Spec Laptop Backpack - Black/Navy,"₹1,569",3.3 out of 5 stars,188,43," Care Instructions: Dry Clean Only   PRODUCT FEATURES: It is Lightweight and comfortable to carry with adjustable padded straps. This Backpack has decent capacity to store essentials with inside zipper pockets to put your private or valuable items. It also has Zipper closure for handy access. It is perfect for business, travelling, meeting, shopping and daily use.<br>   CRAFTSMANSHIP: Each Police backpack is aesthetically designed and hand crafted by expert smiths to ensure consistent superior quality and high value for customers.<br>   LAPTOP COMPARTMENT: Include Padded laptop compartment to ensure your laptop is safe. It is ideal for 15"" Laptop.<br>   Warranty Type:Manufacturer, ; months manufacturing Warranty on Manufacturing Defects only.<br>   Compartment Description: Up To 15 Inches; Color Name: Navy,Black; Age Range Description: Adult; Water Resistance Level: Water Resistant; Style Name: Casual; Pattern Name: Solid<br>  ",B07ZB8NWTZ,,Torero Corporation Pvt Ltd
https://www.amazon.in/ADISA-BP004-Weight-Casual-Backpack/dp/B07G3F1G7T/ref=sr_1_157?crid=2M096C61O4MLT&keywords=bags&qid=1679388614&sprefix=ba%2Caps%2C283&sr=8-157,ADISA Laptop Backpack 31 Ltrs,₹499,4.0 out of 5 stars,"9,083","1,642"," Adjustable Shoulder Handles / Two Bottle holders / Padded Top Handle / Reflector Logo   NOT INCLUDED : Raincover, Headphones & Cable (Images only for display)   Laptop Size : 15.6 inches and below (Bigger than 15.6 inches not recommended)   Compartments : 2 with full padding; Front Easy Access Pocket   Dimensions : LxWxH- 12 x 7 x 18 inches  ",B07G3F1G7T,,ADISA
https://www.amazon.in/Aristocrat-Zeal-Unisex-Grey-Laptop/dp/B0B5YHC1W5/ref=sr_1_158?crid=2M096C61O4MLT&keywords=bags&qid=1679388614&sprefix=ba%2Caps%2C283&sr=8-158,Aristrocrat Unisex Laptop Bag Grey,₹699,4.4 out of 5 stars,18,1, 1)Spacious Compartment 2) Laptop Compatible 3) Front Quick Access Pocket 4) Power Bank Pocket  ,B0B5YHC1W5,"Stylish, Secure feature packed Laptop backpack Spacious Compartment Laptop Compatible Front Quick Access Pocket Power Bank Pocket Padded Grab Handle Shoulder strap re-enforcement","VIP Industries Ltd. DGP House, 5th Floor, 88C Old Prabhadevi Road, Mumbai 400025"
https://www.amazon.in/bg1905-Capacity-Laptop-Travelling-Backpack/dp/B082MKHDJ1/ref=sr_1_159?crid=2M096C61O4MLT&keywords=bags&qid=1679388614&sprefix=ba%2Caps%2C283&sr=8-159,TSPARK Red Lemon bg1905 15.6 inch 35 LTR Capacity Laptop Bag for Men Travelling Hiking Backpack for Men and Women,"₹2,849",4.3 out of 5 stars,64,23," Compartment: Outside 4 compartments including 2 water bottle slot, 1 buckle for keeping quick access belonging, Interior Key Chain Holder, Interior Compartment, Computer Interlayer, Interior Zipper Pocket, Interior Slot Pocket, side pocket for water bottle, Cell Phone Pocket, large main pocket. Multi-layer pocket and storage space, Back pouch for antitheft zipper pocket, Multifunction designs fits for 15.6-inch laptop up to 17-inch laptop.<br><br><br> <br>   Thick back Air mesh cushion supports your spinal during excess weight with air cushion belt carrying system easy to carry on shoulder<br><br><br> <br>   Water resistance material protecting your electronic devices.<br><br><br> <br>   Anti-theft zip at back protecting your electronic gadgets and cards and wallets protects your laptop and other electronic devices, External USB charging with earphone hole.; Use in daily life from office to gym to travelling.<br>; Special Features: Earphone Cord Support<br><br>; Strap Type: Adjustable; Age Range Description: Adult<br> <br>   Pattern Name: Solid <br>  ",B082MKHDJ1,,
https://www.amazon.in/Farraige%C2%AE-Silicone-Crossbody-Waterproof-Stationery/dp/B0B4G8W6MQ/ref=sr_1_160?crid=2M096C61O4MLT&keywords=bags&qid=1679388614&sprefix=ba%2Caps%2C283&sr=8-160,Farraige® Cartoon Soft Silicone Bag Crossbody Shoulder Bag Purse Waterproof Anti Fall Stationery Storage Bag Handbag Sweet Birthday Gift for Children Students Girls,₹634,4.4 out of 5 stars,25,12," 【DIY Crossbody Bag】Rich color label patterns give the bag unique freedom, go out at any time with fashionable satchel bag. It can hold cell phones, small toys, candy, credit card, etc.   【Special Designs】Shoulder Camera Bag have large capacity, easy zipper closure, adjustable shoulder strap freely. Crossbody Purse with 6pcs Carton Tag   【Safe Material】The soft and environmentally friendly material is made of PVC+EVA+Polypropylene Webbing. Comfortable hand feel with fine surface workmanship, durable and dirt-resistant.   【Top Gifts for kids】Perfect for 3 + years old boys, girls, niece, granddaughter, grandson,etc. Nice xmas gifts, birthday gifts for kids, best birthday presents and Christmas gifts for kids.   Durable and Dirt-resistant: Cute Shoulder Handbag are easy to clean and durable. If the chocolate and ice cream dirty the bags, don’t worry, take one wet cloth and wipe it away and do not need to wash.(Attention: Please do not scratch the surface of the bags with sharp object.  ",B0B4G8W6MQ,,
https://www.amazon.in/Victorinox-Nylon-Black-Laptop-31322601/dp/B004UCORV2/ref=sr_1_161?crid=2M096C61O4MLT&keywords=bags&qid=1679388706&sprefix=ba%2Caps%2C283&sr=8-161,Victorinox Nylon Black Laptop Bag (31322601),"₹25,320",4.5 out of 5 stars,11,7," Outer Material: 1680D Ballistic Nylon, Color: Black   Dimensions: 45 cms  ",B004UCORV2,Victorinox Nylon Black Laptop Bag (31322601),Victorinox
https://www.amazon.in/Wesley-briefcase-professional-Briefcase-messenger/dp/B0BJVDN7VT/ref=sr_1_162?crid=2M096C61O4MLT&keywords=bags&qid=1679388706&sprefix=ba%2Caps%2C283&sr=8-162,Wesley office Laptop Bag briefcase notebook professional business 15.6 Inch Briefcase messenger sling Water resistant Laptop Bag Tablet Business Carrying Handbag for Women and Men (Charcoal Black),₹498,4.0 out of 5 stars,"1,173",118," Wesley laptop bag professional series 15.6 inch   Laptop compartment with dual zippered access and thick foam padding, protects your laptop very well.   Made of top fabric, designed to be very lightweight and slim, but stylish, practical and durable.   Luggage strap which helps to easily fix the briefcase on handle of your trolley   Trendy look and design. Dimensions: 17 x12.5x3.5 inch  ",,Laptop bag,
https://www.amazon.in/Lenovo-Laptop-Everyday-Backpack-Black/dp/B07GM5NR14/ref=sr_1_163?crid=2M096C61O4MLT&keywords=bags&qid=1679388706&sprefix=ba%2Caps%2C283&sr=8-163,Lenovo Everyday Laptop Backpack B515 15.6-inch Water Repellent Black,₹890,4.1 out of 5 stars,"3,668","1,063"," “COMPATIBLE WITH 15.6 INCH LAPTOP”: Lenovo 14"" Laptop Everyday Backpack B515 fits laptop up to 15.6"" Dimensions (W x D x H) (cm) : 32.5 x 12 x 44 (inches) : 12.8"" x 4.7"" x 17.3"" Weight: Starting at 1.5 lbs (700 g)<br> <br>   Material Type: Fabric; Water Resistance Level: Water Resistant; Age Range Description: Adult; Special Features: Laptop Compartment; Closure Type: Zipper; Pocket Description: Utility Pocket; Lining Description: Polyester; Strap Type: Padded Strap; Pattern Name: Solid; Style Name: Daypack Backpacks <br>  ",,,
https://www.amazon.in/Gear-Classic-Leather-Backpack-LBPCLSLTH0101/dp/B07G4D13LB/ref=sr_1_164?crid=2M096C61O4MLT&keywords=bags&qid=1679388706&sprefix=ba%2Caps%2C283&sr=8-164,Gear Classic 20L Faux Leather Water Resistant Anti Theft Laptop Bag/Backpack for Men/Women-Black,"₹1,030",4.4 out of 5 stars,"2,610",424," Outer material: synthetic, color: black; Waterproof   Capacity: 20 liters; Weight: 560 grams; Dimensions: 48 cms x 32 cms x 14 cms (LxWxH)   Number of compartments: 2   Laptop compatibility: yes, laptop size: 16strap type: adjustable   Special Features: Back Padding; Closure Type: Zipper; Age Range Description: Adult; Pocket Description: Utility Pocket   Concealed quick access Pockets on back panel ,Adjustable Anti sweat padded Shoulder straps , Padded Laptop sleeve,2 External Pockets, Padded Back Panel Cushioned with Anti Sweat Fabric,Embedded Organizer , USB and Headphone cable slot .  ",,,
https://www.amazon.in/Lavie-Broxa-Womens-Sling-Plum/dp/B08JDG1NKX/ref=sr_1_165?crid=2M096C61O4MLT&keywords=bags&qid=1679388706&sprefix=ba%2Caps%2C283&sr=8-165,Lavie Women's Broxa Flap Over Sling Bag | Ladies Purse Handbag,₹999,4.2 out of 5 stars,"5,676",601," Lavie Broxa sling is a stylish carry for women. It is trendy, light weight, spacious and available in beautiful multiple colors. The bag is beautifully crafted from premium man-made leather with latest saffiano texture & wavy stitch pattern at the front. The bag has a well-stitched inner lining for easy accessibility and storage.   Dimension: 21.5 cm in length X 9 cm in width X 15 cm in height   Broxa sling bag has a flat bottom to keep your essentials intact. Interior has 1 main compartment, with a flap closure on top for safety. Inside the bags there is 1 slip pocket alongside 1 zip pocket, providing space for keeping your phone, portable charger, coins, sanitizer etc. The bag also has adjustable sling strap to carry it in various ways, fastened with gold toned hardware.   This sling is perfect for ladies to carry for a weekend getaway or even a day at the mall for shopping. It can be paired with a playsuit, a basic crop top & jeans. This spacious and sturdy bag makes for a perfect gift for all your occasions  ",B08JDG1NKX,"Complete your modish look with this ultra-modern sling bag by Lavie - Featuring intricately geometric patterns, individual pockets to organize everyday essentials, and snap fastening for convenient security, this red piece has been designed to flaunt an alluring appeal. This sling bag is an ideal example of what today's fashionista deserves: a blend of trend and substance.",Lavie
https://www.amazon.in/Capacity-Cosmetic-Portable-Leather-Organizer/dp/B0BTDKL3KX/ref=sr_1_166?crid=2M096C61O4MLT&keywords=bags&qid=1679388706&sprefix=ba%2Caps%2C283&sr=8-166,"Renva Large Capacity Cosmetic Travel Bag, Women's Makeup Travel Bag Portable Leather Cosmetic Bag, Makeup Storage Bags with Handle and Divider,Makeup Organizer Bags (1 pcs, Black)",₹629,4.0 out of 5 stars,16,2," 【High-Quality Materials】 : Travel makeup pouch made of easy-to-clean PU leather fabric, special water-resistant surface to prevent internal products from getting wet.   【PU Leather makeup bag function】 : Portable and Lightweight design with handle, Made of high-quality soft PU leather fabric, strong thickness make the bag more durable and easy to clean, special water-resistant surface to prevent internal products from getting wet.No need to worry about messy leaks when traveling.   【Multifunctional storage makeup bags】 : This Make up Bags not only can storage your cosmetics, but also Jewelry, Electronic Accessories, Camera, Essential oil, Toiletries, Shaving Kit, glasses,Valuable objects and so on.   【Convenient and Durable Handle】 : The zipper of the makeup travel bag opening design is reasonable,It's a easy to handle and very practical zipper pouch   【Wonderful Gift】 : The travel makeup bag is perfect for daily use or travelling, it's a great gift for women and girls with the gift box on Mother's Day, Women's Day or Christmas .  ",B0BTDKL3KX,,Renva India
https://www.amazon.in/uppercase-Backpack-2300EBP1-repellent-sustainable/dp/B0B69M182Q/ref=sr_1_167?crid=2M096C61O4MLT&keywords=bags&qid=1679388706&sprefix=ba%2Caps%2C283&sr=8-167,"uppercase Medium 17 Ltrs Vegan Leather (upto 14 inch) Laptop Backpack 2300EBP1 3x more water resistant sustainable bags with rain proof zippers for Men, Women, Boys and Girls, 750 Days warranty","₹1,600",4.0 out of 5 stars,373,72, Handcrafted with care and made up of premium quality robust material  ,B0B69M182Q,,Acefour Accessories Pvt. Ltd.
https://www.amazon.in/Amazon-Basics-Professional-Backpack-15-inch-Laptop/dp/B09W4WB3K5/ref=sr_1_168?crid=2M096C61O4MLT&keywords=bags&qid=1679388706&sprefix=ba%2Caps%2C283&sr=8-168,"Amazon Basics - Laptop Backpack/College Bag/Travel Bag for 15.6-inch Laptop, Water-Resistant, Casual","₹1,349",3.5 out of 5 stars,5,2," Laptop backpack made from water-resistant, strong and durable polyester   Contains three large compartments, one easy-access front pocket, two side pockets with zipper, and two water-bottle pockets   Well-cushioned polyester pocket that stores up to 15.6-inch laptop   Cushioned shoulder strap for added comfort and well-padded back to provide support   Invisible and theft-resistant zipper pocket on the edge of the back panel protects valuable items such as earbuds, passports, and phone   ·Lightweight and convenient to carry in three, flexible ways   Dimensions: 45 x 30 x 17 cm (L x W x H)   Weight: 0.78 gms  ",,,
https://www.amazon.in/Tabelito-Laptop-Backpack-15-6-inch-Repellent/dp/B08Y3L4PHK/ref=sr_1_169?crid=2M096C61O4MLT&keywords=bags&qid=1679388706&sprefix=ba%2Caps%2C283&sr=8-169,Tabelito® Casual 15.6 Inch (39.6 cm) Water Repellent Laptop Backpack Office College School Business Travel Bag Suitable for Men Women Boys & Girls Capacity 25 Litre (Grey),₹549,4.2 out of 5 stars,"1,597",433," LARGE CAPACITY & ORGANIZED: Tabelito backpack has one separate laptop compartment that can hold any laptop up to 15.6 inch. It also has one spacious compartment for storing any item like daily necessities, tech related items, accessories, toiletries and many more. The front compartment comprises of many pockets, key hook to store your item in an organized manner and easier to find.   ORGANIZERS WITH MULTI LEVEL ZIPPERS: Front two slanted pocket perfect for quick finds such as your ID for work, f gear laptop bags . keys for open door, two side pockets for water bottle and compact umbrella make your items organized. it can be use as school college bags for girls / backpack for men /backpacks for women . you can use it as a gift for men . bags for travelling   COMFY & STURDY: Made from WATER RESISTANT and DURABLE ECO-FRIENDLY nylon fabric with Two PADDED shoulder straps, relieve the stress of shoulder, simple but comfortable back design offer your great back support, making your working, journey and travelling more convenient wherever you go. you can use it such as office bag for men . office bag for women .   LIGHTWEIGHT & DURABLE: Light-weight Carrying and perfect for business traveling or trip, weekend getaways, back to school, outdoor activities and college bag for men etc;   MULTIPURPOSE & SIZE: 20 x 12.2 x 5.7 Inch, perfect to throw under your seat on an airplane when you are traveling or on business trip. Suitable for back to school college, can be easily stored. Good choose for a business laptop backpack, work backpack, laptop bag for men and women, also will be a good gifts for women, gifts for men, gifts for boyfriend or girlfriend and gift bag for travelers.   COMPATIBLE WITH LAPTOP & TABLET: Fits upto 15.6 Inches Laptops Apple/Dell/Lenovo/ASUS/Hp/Samsung/Mi/MacBook/Ultrabook/Thinkpad/IdeaPad/Surfacepro, Laptops Tablets, It is Water Repellent, Ultra-Light, Easy to carry, Office bag for Men & Women, and it's fabric prevents scratches.  ",,,
https://www.amazon.in/WILDHORN-Backpack-Compartment-Business-Stitching/dp/B09QL66G55/ref=sr_1_170?crid=2M096C61O4MLT&keywords=bags&qid=1679388706&sprefix=ba%2Caps%2C283&sr=8-170,"WILDHORN 31L Laptop Backpack for Men / Women I Fits upto 15.6"" Laptop I Waterproof I Travel / Business / College Bookbags",₹599,4.1 out of 5 stars,949,155," ?LOTS OF STORAGE SPACE&POCKETS- This travel backpack design with multi independent pockets for large storage and organization for small items. 2 spacious main multi compartments with many hidden pockets can accommodate lots of stuffs like college supplies, travel accessories, clothes, stationery, notebook, Mesh pockets at side for water bottle and compact umbrella make your items organized and easier to find.Ideal book bag backpack for high school boys perfectly.<br>   ?DIMENSION & DURABLE MATERIAL - Size of extra large backpack:18.89 x 12.0 x 2.99 (inches), perfect to throw under your seat on an airplane when you are traveling or on business trip.Separate padded laptop compartment fits most 15.5 inch laptop /Ipad/Computer.The business computer backpack made from high quality polyester fabric shockproof with high density nylon lining for better TEAR & WATER RESISTANT and heavy duty backpack.<br>   ?MULTIPURPOSE - At checkpoint, unfolds the travel backpack freely 90-180 degrees making you quickly through the airport security and keep items tidy, exclusive designed for airplane travel. The big backpack is perfect for indoor/outdoor activities. Served as a durable laptop backpack, large school backpack for Teen Boys/Girls, large laptop bag or spacious college backpack. Perfect travel gifts for men women who like international travel, camping, hiking and overnight trip.<br>   ?SECURE& SAFE - Durable Metal Zippers,protects wallet and other items inside from thief and offers a private space.So you never have to worry about someone stealing your laptop, ipad, business file, homework and anything value, keep you a nice peace of mind. Durable metal zippers close and open smoothly, ensure a secure and long-lasting usage everyday or weekend.;Age Range Description: Adult; Pocket Description: Utility Pocket; Pattern Name: Solid; Style Name: Classic<br>   ?BREATHABLE & COMFORTABLE - Padded and breathable mesh back panel of this Backpack design help for the air convection, ventilation and heat elimination. Comfortable wide breathable mesh shoulder straps with plentiful sponge pad help relieve the stress from your shoulder. Both sides of the shoulder strap with design, can hang sunglasses and other small pendants.Premium bookbags for men also school backpack for teen boys. And it is a Ideal gifts for men women.<br>  ",B09QL66G55,,WildHorn
